"author","papers"
"Sá, Victor","Graph Connectivity Maintenance for Multi-Robots Systems under Visual Occlusion Constraints via CBFs"
"Teixeira, Leonardo R. L.","Unplugged Computing and Educational Robotics in Early Childhood Education: Outreach Experiences with Playful and Sustainable Practices"
"Terra, Marco H.","UAV Visual Servoing for Electrical Distribution System Inspection; UPI-Dataset: A Balanced UAV-Based Image Dataset for Defect and Anomaly Detection in Power Distribution Systems"
"Thema, Masa","Proprioceptive ContactNet: Towards Bridging the Sim-to-Real Gap in Quadrupedal Contact Estimation"
"Tonin, Lucca S.","A 5R Robotic Master Arm Proposal for Remote Control of the KUKA KR3 R540 Industrial Robot"
"Torres, Clayton J.","A Django-Based Web Framework for Teleoperation of Differential Robots Integrated with ROS2"
"Toschi, Lucas","Next-Best-View using Deep Reinforcement Learning with Quadruped Robots in Simulation"
"Tuxi, Thiago M.","Vision-Based UAV Tracking for UAV–UGV Cooperation Using YOLOv11 and Kalman Filtering"
"Utiyama, Daniela M. O.","IMU based displacement and impact estimation for the analysis of human-exoskeleton interactions"
"Valci, Modesto","An Active Learning Methodology for Teaching the Kalman Filter in Robotics Applications"
"Vangasse, Arthur","Graph Connectivity Maintenance for Multi-Robots Systems under Visual Occlusion Constraints via CBFs"
"Vangasse, Arthur C.","An Agentic Framework for Aerial Swarms: Integrating LLMs with the Crazyswarm2"
"Varella, Jerry","Exploiting domain knowledge for content-agnostic template matching in structured environments"
"Vasconcellos, Eduardo C.","Challenges on Operational Procedures and Practical Experiences on Data Collection with Autonomous Sailboats"
"Vazquez, Priscila C.","Development of an Expressive Self-Balancing Companion Robot"
"Victoria, Sarah","Seed Dispenser for Reforestation with Drones"
"Vinente, Kenny","Exploiting domain knowledge for content-agnostic template matching in structured environments"
"Vivaldini, Kelen C. T.","A Comparative Benchmark of Path Planning Algorithms in Dynamic Environments; An Integrated System for Fast Mapping and Autonomous Navigation of Mobile Robots using ROS; Improving Indoor Mobile Robot Localization Using Integrated EKF-SLAM, AMCL and ArUco Fiducial Markers; Path Planning in Dynamic Environments: A Comparison of Algorithms in the RoboCup SSL"
"Walter, Esteban","Challenges on Operational Procedures and Practical Experiences on Data Collection with Autonomous Sailboats"
"Werneck, Brandão R. G. A.","Challenges on Operational Procedures and Practical Experiences on Data Collection with Autonomous Sailboats"
"Wolf, Denis F.","An Attentive Multi-Scale Approach for Semantic Segmentation; Transformer-based Decision-Making using Segmented Bird’s Eye View Images and Deep Reinforcement Learning"
"Yasuda, Pedro","From Simulation to Hardware: Development of a Modular Underactuated Biped Robot"
"Youssef, Samer","A 5R Robotic Master Arm Proposal for Remote Control of the KUKA KR3 R540 Industrial Robot"
"Zênite, I. I. N.","Development of a Robotic System for the Introduction of Space Robotics Concepts in Basic Education"
